{
  "id": "validated-trust",
  "term": "Validated trust",
  "short": "At agent scale, operators judge deliveries through validated system signals rather than by reading every changed line.",
  "patterns": [
    "model-trust-map",
    "council",
    "executable-safety-net",
    "quality-gate-agents",
    "scheduled-quality-sweeps",
    "review-result",
    "orchestrator-subagent",
    "escalation-cascade",
    "companion-model",
    "compute-invest-as-quality-signal",
    "skip-the-pull-request",
    "workflow-sized-tasks"
  ]
}
